[
  {
    "name": "my-algorithm",
    "version": "1.0.0",
    "title": "My first algorithm",
    "description": "Reads an HDF5 file and outputs two TIFF images and a CSV",
    "author_name": "John_Doe",
    "author_url": "http://www.example.com",
    "timeout": 3600,
    "cpus_required": 10.0,
    "mem_required": 10240.0,
    "disk_out_const_required": 0.0,
    "disk_out_mult_required": 0.0,
    "interface": {
      "output_data": [
        {
          "media_type": "image/tiff",
          "required": true,
          "type": "file",
          "name": "output_file_tif",
          "glob": "outfile1*.tif"
        },
        {
          "media_type": "image/tiff",
          "required": true,
          "type": "file",
          "name": "output_file_tif2",
          "glob": "outfile2*.tif"
        },
        {
          "media_type": "text/csv",
          "required": true,
          "type": "file",
          "name": "output_file_csv",
          "glob": "outfile*.csv"
        }
      ],
      "command_arguments": "${input_file} ${job_output_dir}",
      "input_data": [
        {
          "media_types": [
            "image/x-hdf5-image"
          ],
          "required": true,
          "type": "file",
          "name": "input_file"
        }
      ],
      "command": "/app/my_wrapper.sh"
    },
    "error_mapping": [
      {
        "code": 1,
        "name": "ErrorName",
        "title": "Error Title",
        "description": "Error Description",
        "category": "SYSTEM"
      },
      {
        "code": 2,
        "name": "ErrorName",
        "title": "Error Title",
        "description": "Error Description",
        "category": "DATA"
      },
      {
        "code": 3,
        "name": "ErrorName",
        "title": "Error Title",
        "description": "Error Description",
        "category": "ALGORITHM"
      }
    ]
  }
]